cluster_id,rank,text,timestamp
0,1,"  Happy monday \u270c\ufe0f Blouson #sudexpress \u2022 \xc9charpe #Zara \u2022 Bottines #Sandro. \n#ootd#outfitoftheday#thisime#mystyle#outfitshare#outfitpost#fwis#fromwhereistand  fromwhereistand, fwis, sudexpress, outfitshare, outfitoftheday, mystyle, outfitpost, ootd, zara, sandro, thisime",2016-01-25 12:24:13
0,2,"  #ootd #ootdfashion #fromwhereistand #jacket #leather #isabelmarant #kady#jeans #shoes #zara #zaradaily #itbag #valentino #vavavoom #instapic #instacool #instagram #instagood #instadaily #instagramers #instafashion #fashion #fashiongram #fashionpost #fashionista #fashiondiaries #fashionblogger #wassamathieu #  fashion, instagram, itbag, instagramers, fashionista, instapic, jeans, isabelmarant, fashiongram, ootd, fashionpost, instadaily, zaradaily, valentino, fromwhereistand, fashiondiaries, jacket, ootdfashion, leather, shoes, instagood, wassamathie, kady, instacool, zara, vavavoom, fashionblogger, instafashion",2016-01-26 14:57:33
0,3,"  Ootd \U0001f380 #outfitpost #outfitoftheday #instadaily #monday #slim #dentelle #zara #sneakers #isabelmarant #look #mode #fashion #me #blonde #girl #coat #fauxfurcoat  fashion, monday, slim, isabelmarant, outfitpost, blonde, girl, me, fauxfurcoat, look, instadaily, dentelle, outfitoftheday, sneakers, mode, coat, zara",2016-01-25 12:59:31
0,4,"  Layering is always the best for these chilly days \u2744\ufe0f\u263a\ufe0f *details on the blog now @00000 #torisherri #southmoonunder #smustorestyle #stevemadden #lysses #hue #freepeople #forever21 #blanknyc #nepals #alexandani #fashionblogger  southmoonunder, hue, freepeople, torisherri, alexandani, smustorestyle, forever21, stevemadden, blanknyc, fashionblogger, lysses, nepals",2016-01-27 03:21:35
0,5,"  Sunny Sundays \U0001f49b #virginiahighlands #family #love #iro #jacket #zara #sweater #citizensofhumanity #carlie #highrise #skinny #jeans #isabelmarant #crisi #boots  highrise, love, family, sweater, citizensofhumanity, jeans, isabelmarant, boots, jacket, iro, zara, skinny, virginiahighlands, crisi, carlie",2016-01-24 20:08:28
1,1,"  \U0001f525\U0001f525\u0e25\u0e14\u0e19\u0e49\u0e33\u0e2b\u0e19\u0e31\u0e01\u0e41\u0e1a\u0e1a\u0e44\u0e21\u0e48\u0e42\u0e22\u0e42\u0e22\u0e48 \u0e14\u0e49\u0e27\u0e22\u0e40\u0e17\u0e04\u0e42\u0e19\u0e42\u0e25\u0e22\u0e35\u0e23\u0e30\u0e14\u0e31\u0e1a cell \u0e08\u0e32\u0e01\u0e2d\u0e40\u0e21\u0e23\u0e34\u0e01\u0e32 \U0001f4f2 Line ID: 0971952555 \U0001f4de Tel: 0971952555  siambrandname, love, business, sbntown, slim, igramlike, atreasurebox, americanapparel, \u0e02\u0e32\u0e22\u0e02\u0e2d\u0e07, world, somethingboudoir, \u0e15\u0e32\u0e21\u0e2b\u0e32\u0e21\u0e32\u0e19\u0e32\u0e19, hiend, network, diet, \u0e15\u0e32\u0e21\u0e2b\u0e32, young, instagood, food, youthintrend, store, igers",2016-01-26 18:00:21
1,2,"  \U0001f493\U0001f493\u0e40\u0e0b\u0e23\u0e31\u0e48\u0e21\u0e17\u0e35\u0e48\u0e14\u0e35\u0e17\u0e35\u0e48\u0e2a\u0e38\u0e14 \u0e15\u0e48\u0e2d\u0e22\u0e2d\u0e14\u0e23\u0e32\u0e07\u0e27\u0e31\u0e25\u0e42\u0e19\u0e40\u0e1a\u0e25 2 \u0e23\u0e32\u0e07\u0e27\u0e31\u0e25 \u0e25\u0e07\u0e19\u0e34\u0e15\u0e22\u0e2a\u0e32\u0e23\u0e14\u0e31\u0e07\u0e17\u0e31\u0e48\u0e27\u0e42\u0e25\u0e01 \u0e43\u0e0a\u0e49\u0e19\u0e27\u0e31\u0e15\u0e01\u0e23\u0e23\u0e21\u0e40\u0e2d\u0e01\u0e2a\u0e34\u0e21\u0e18\u0e34\u0e4c Human EGF 200+ \u0e02\u0e31\u0e49\u0e19\u0e2a\u0e39\u0e07\u0e2a\u0e38\u0e14 \u0e1c\u0e25\u0e25\u0e31\u0e1e\u0e18\u0e4c\u0e2d\u0e31\u0e19\u0e19\u0e48\u0e32\u0e17\u0e36\u0e48\u0e07 \u0e1e\u0e23\u0e49\u0e2d\u0e21\u0e43\u0e2b\u0e49\u0e17\u0e38\u0e01\u0e04\u0e19\u0e1e\u0e34\u0e2a\u0e39\u0e08\u0e19\u0e4c \U0001f4de062 409 6964 \U0001f4f2Add line id: collawhiteshop\n\u0e2b\u0e23\u0e37\u0e2d\u0e04\u0e25\u0e34\u0e01\u0e25\u0e34\u0e07\u0e04\u0e4c\u0e19\u0e35\u0e49\u0e44\u0e14\u0e49\u0e40\u0e25\u0e22\u0e08\u0e23\u0e49\u0e32 http://line.me/ti/p/~collawhiteshop  shop, siambrandname, somethingboudoir, beauty, sbntown, slim, atreasurebox, americanapparel, ageless, hi, \u0e02\u0e32\u0e22\u0e02\u0e2d\u0e07, world, kanken, \u0e15\u0e32\u0e21\u0e2b\u0e32\u0e21\u0e32\u0e19\u0e32\u0e19, lookbookbkk, network, hiend, luminesce, sbn, business, diet, \u0e15\u0e32\u0e21\u0e2b\u0e32, stemcell, growthfactor, young, food, store",2016-01-27 01:56:10
1,3,"  \U0001f481\U0001f3fb\u2728\U0001f389\u0e21\u0e32\u0e40\u0e1e\u0e34\u0e48\u0e21\u0e41\u0e25\u0e49\u0e27\u0e08\u0e49\u0e32\n\nCOACH SWAGGER 27\U0001f45d\U0001f496 \u0e02\u0e19\u0e32\u0e14 7.5 \u0e19\u0e34\u0e49\u0e27\n\n\u0e2a\u0e35\u0e21\u0e48\u0e27\u0e07\u0e2d\u0e48\u0e2d\u0e19\U0001f341\U0001f337\u0e2a\u0e27\u0e22\u0e2a\u0e38\u0e14\u0e46\n\n\u0e16\u0e39\u0e01\u0e21\u0e32\u0e01 !! \U0001f4b8\U0001f4a5 14,990\u0e3f ---------------------------------------------------\n\u2705\u0e1e\u0e23\u0e49\u0e2d\u0e21\u0e2a\u0e48\u0e07 \u0e42\u0e2d\u0e19\u0e20\u0e32\u0e22\u0e43\u0e19 24 \u0e0a\u0e21. \u0e2b\u0e23\u0e37\u0e2d\u0e21\u0e31\u0e14\u0e08\u0e33\u0e44\u0e27\u0e49\u0e01\u0e48\u0e2d\u0e19 \u0e25\u0e49\u0e2d\u0e04\u0e2a\u0e34\u0e19\u0e04\u0e49\u0e32\u0e43\u0e2b\u0e49\u0e04\u0e48\u0e30\n\u2705\u0e1e\u0e23\u0e35\u0e2d\u0e2d\u0e40\u0e14\u0e2d\u0e23\u0e4c \u0e2b\u0e25\u0e31\u0e07\u0e21\u0e31\u0e14\u0e08\u0e33 \u0e08\u0e31\u0e14\u0e0b\u0e37\u0e49\u0e2d\u0e43\u0e2b\u0e49\u0e04\u0e48\u0e30\n\u2705\u0e1f\u0e23\u0e35ems\n\u2705\u0e44\u0e21\u0e48\u0e21\u0e35\u0e1b\u0e23\u0e30\u0e27\u0e31\u0e15\u0e34\u0e42\u0e01\u0e07\n\u2705\u0e2a\u0e48\u0e07\u0e08\u0e23\u0e34\u0e07 \u0e2a\u0e48\u0e07\u0e44\u0e27 \u0e40\u0e25\u0e37\u0e48\u0e2d\u0e19\u0e14\u0e39\u0e23\u0e35\u0e27\u0e34\u0e27\u0e14\u0e49\u0e32\u0e19\u0e25\u0e48\u0e32\u0e07\u0e40\u0e25\u0e22\u0e08\u0e23\u0e49\u0e32\n\u2705\u0e23\u0e32\u0e04\u0e32\u0e02\u0e36\u0e49\u0e19\u0e25\u0e07\u0e15\u0e25\u0e2d\u0e14\u0e15\u0e32\u0e21\u0e42\u0e1b\u0e23\u0e40\u0e21\u0e01\u0e32\n\u2705\u0e2a\u0e2d\u0e1a\u0e16\u0e32\u0e21\u0e40\u0e1e\u0e34\u0e48\u0e21\u0e40\u0e15\u0e34\u0e21\U0001f194kitkat211\n\n#\u0e15\u0e32\u0e21\u0e2b\u0e32 #\u0e15\u0e32\u0e21\u0e08\u0e19\u0e40\u0e08\u0e2d #\u0e15\u0e32\u0e21\u0e2b\u0e32\u0e21\u0e32\u0e19\u0e32\u0e19#\u0e02\u0e32\u0e22 #\u0e02\u0e32\u0e22\u0e02\u0e2d\u0e07 #coach #coachmen #weloveshopping #siambrandname#pantip #pantown#coachsale#coachoutlet#coachbkk#coachfactory#coachshop#\u0e2d\u0e22\u0e32\u0e01\u0e02\u0e32\u0e22#coachwallet#rayban#kipling#katespade#sbn#coachoutlet #charleskeith#lynaround#lyn#\u0e14\u0e32\u0e23\u0e32#michealkors#fossil#guess  coachfactory, siambrandname, weloveshopping, coach, michealkors, coachwallet, \u0e02\u0e32\u0e22\u0e02\u0e2d\u0e07, \u0e14\u0e32\u0e23\u0e32, charleskeith, coachbkk, coachshop, pantip, lyn, lynaround, \u0e15\u0e32\u0e21\u0e2b\u0e32\u0e21\u0e32\u0e19\u0e32\u0e19, coachoutlet, kipling, rayban, guess, pantown, sbn, coachsale, coachmen, \u0e15\u0e32\u0e21\u0e08\u0e19\u0e40\u0e08\u0e2d, katespade, \u0e2d\u0e22\u0e32\u0e01\u0e02\u0e32\u0e22, fossil, \u0e15\u0e32\u0e21\u0e2b\u0e32, \u0e02\u0e32\u0e22",2016-01-27 06:55:31
1,4,"  \U0001f534\U0001f534\u0e1e\u0e23\u0e49\u0e2d\u0e21\u0e2a\u0e48\u0e07\U0001f534\U0001f534\n\U0001f34d\U0001f34d\U0001f34d\u0e40\u0e14\u0e23\u0e2a\u0e2a\u0e31\u0e1b\u0e1b\u0e30\u0e23\u0e14\U0001f34d\U0001f34d\U0001f34d \u0e1c\u0e49\u0e32\u0e41\u0e04\u0e19\u0e27\u0e32\u0e2a \u0e07\u0e32\u0e19\u0e2a\u0e27\u0e22 \u0e01\u0e25\u0e35\u0e1a\u0e23\u0e2d\u0e1a \u0e2a\u0e27\u0e22\u0e21\u0e32\u0e01\u0e46\u0e46\u0e04\u0e48\u0e32 \u0e07\u0e32\u0e19\u0e40\u0e01\u0e23\u0e14\u0e14\u0e35 \u2b55\ufe0f\u0e1b\u0e01\u0e15\u0e34370-.\n\u0e2d\u0e01 32-36 \""\"" \u0e22\u0e32\u0e27 29-30\""\""\n------\n\u2b55\ufe0f\u0e41\u0e21\u0e48\u0e2d\u0e49\u0e27\u0e19390-.\n\u0e2d\u0e01  36-40 \""\""\u0e22\u0e32\u0e27 31-33\""\""\n.\n\U0001f4f2Line ID: npberry\n\u0e0b\u0e37\u0e49\u0e2d2\u0e0a\u0e38\u0e14\u0e2a\u0e48\u0e07\u0e1f\u0e23\u0e35 \u0e04\u0e25\u0e30\u0e44\u0e14\u0e49\u0e17\u0e31\u0e49\u0e07\u0e23\u0e49\u0e32\u0e19\u0e08\u0e49\u0e32\u203c\ufe0f\n#shopthai #theabythara #vatanika #marihorn #topshop #igthai #chaps #ccoo #lovebird #\u0e04\u0e2a\u0e2d #lovemetender #lyn #queenp #nokara #matin #jaspal #cps #\u0e2d\u0e22\u0e32\u0e01\u0e02\u0e32\u0e22 #mng #stylenanda #suda #lookbooklookbook #katespade #lookbook #baobao #topshopthailand #secondhand #rinrata #issue  shopthai, topshopthailand, igthai, suda, jaspal, lovebird, topshop, ccoo, secondhand, matin, queenp, lyn, mng, lookbook, baobao, theabythara, katespade, lookbooklookbook, \u0e04\u0e2a\u0e2d, lovemetender, vatanika, stylenanda, \u0e2d\u0e22\u0e32\u0e01\u0e02\u0e32\u0e22, chaps, marihorn, nokara, rinrata, cps, issue",2016-01-27 07:28:41
1,5,"  \U0001f481\U0001f3fb\u2728\u0e1e\u0e23\u0e49\u0e2d\u0e21\u0e2a\u0e48\u0e07 \u231a\ufe0fARMANI WATCH \u0e2b\u0e25\u0e48\u0e2d\u0e21\u0e32\u0e01\u0e01\U0001f4a6 \u0e01\u0e25\u0e48\u0e2d\u0e07\u0e41\u0e17\u0e49 \u0e2d\u0e38\u0e1b\u0e01\u0e23\u0e13\u0e4c\u0e04\u0e23\u0e1a\n\n\u0e23\u0e32\u0e04\u0e32\u0e14\u0e35\u0e21\u0e32\u0e01 !! \U0001f4b8\U0001f4a5 6,290\u0e3f ---------------------------------------------------\n\u274c\u0e44\u0e21\u0e48\u0e21\u0e35\u0e2b\u0e25\u0e38\u0e14Qc\n\u274c\u0e44\u0e21\u0e48\u0e21\u0e35\u0e22\u0e49\u0e2d\u0e21\u0e41\u0e21\u0e27\n\U0001f44d\u0e2d\u0e38\u0e1b\u0e01\u0e23\u0e13\u0e4c\u0e04\u0e23\u0e1a \U0001f44d\u0e23\u0e32\u0e04\u0e32\u0e16\u0e39\u0e01\u0e01\u0e27\u0e48\u0e32shop\n\U0001f44d\u0e02\u0e2d\u0e07\u0e41\u0e17\u0e49\u0e08\u0e32\u0e01usa\u0e17\u0e38\u0e01\u0e40\u0e23\u0e37\u0e2d\u0e19\U0001f1fa\U0001f1f8\n--------------------------------------------------\n\u2705\u0e1e\u0e23\u0e49\u0e2d\u0e21\u0e2a\u0e48\u0e07 \u0e42\u0e2d\u0e19\u0e20\u0e32\u0e22\u0e43\u0e19 24 \u0e0a\u0e21. \u0e2b\u0e23\u0e37\u0e2d\u0e21\u0e31\u0e14\u0e08\u0e33\u0e44\u0e27\u0e49\u0e01\u0e48\u0e2d\u0e19 \u0e25\u0e49\u0e2d\u0e04\u0e2a\u0e34\u0e19\u0e04\u0e49\u0e32\u0e43\u0e2b\u0e49\u0e04\u0e48\u0e30\n\u2705\u0e1e\u0e23\u0e35\u0e2d\u0e2d\u0e40\u0e14\u0e2d\u0e23\u0e4c \u0e2b\u0e25\u0e31\u0e07\u0e21\u0e31\u0e14\u0e08\u0e33 \u0e08\u0e31\u0e14\u0e0b\u0e37\u0e49\u0e2d\u0e43\u0e2b\u0e49\u0e04\u0e48\u0e30\n\u2705\u0e1f\u0e23\u0e35ems\n\u2705\u0e44\u0e21\u0e48\u0e21\u0e35\u0e1b\u0e23\u0e30\u0e27\u0e31\u0e15\u0e34\u0e42\u0e01\u0e07\n\u2705\u0e2a\u0e48\u0e07\u0e08\u0e23\u0e34\u0e07 \u0e2a\u0e48\u0e07\u0e44\u0e27 \u0e40\u0e25\u0e37\u0e48\u0e2d\u0e19\u0e14\u0e39\u0e23\u0e35\u0e27\u0e34\u0e27\u0e14\u0e49\u0e32\u0e19\u0e25\u0e48\u0e32\u0e07\u0e40\u0e25\u0e22\u0e08\u0e23\u0e49\u0e32\n\u2705\u0e23\u0e32\u0e04\u0e32\u0e02\u0e36\u0e49\u0e19\u0e25\u0e07\u0e15\u0e25\u0e2d\u0e14\u0e15\u0e32\u0e21\u0e42\u0e1b\u0e23\u0e40\u0e21\u0e01\u0e32\n\u2705\u0e2a\u0e2d\u0e1a\u0e16\u0e32\u0e21\u0e40\u0e1e\u0e34\u0e48\u0e21\u0e40\u0e15\u0e34\u0e21\U0001f194kitkat211\n\n#\u0e15\u0e32\u0e21\u0e2b\u0e32 #\u0e15\u0e32\u0e21\u0e08\u0e19\u0e40\u0e08\u0e2d #\u0e15\u0e32\u0e21\u0e2b\u0e32\u0e21\u0e32\u0e19\u0e32\u0e19#\u0e02\u0e32\u0e22 #\u0e02\u0e32\u0e22\u0e02\u0e2d\u0e07 #coach #coachmen #weloveshopping #siambrandname#pantip #pantown#coachsale#coachoutlet#coachbkk#coachfactory#coachshop#\u0e2d\u0e22\u0e32\u0e01\u0e02\u0e32\u0e22#coachwallet#rayban#kipling#katespade#sbn#coachoutlet #charleskeith#lynaround#lyn#\u0e14\u0e32\u0e23\u0e32#michealkors#fossil#guess  coachfactory, siambrandname, weloveshopping, coach, michealkors, coachwallet, \u0e02\u0e32\u0e22\u0e02\u0e2d\u0e07, \u0e14\u0e32\u0e23\u0e32, charleskeith, coachbkk, coachshop, pantip, lyn, lynaround, \u0e15\u0e32\u0e21\u0e2b\u0e32\u0e21\u0e32\u0e19\u0e32\u0e19, coachoutlet, kipling, rayban, guess, pantown, sbn, coachsale, coachmen, \u0e15\u0e32\u0e21\u0e08\u0e19\u0e40\u0e08\u0e2d, katespade, \u0e2d\u0e22\u0e32\u0e01\u0e02\u0e32\u0e22, fossil, \u0e15\u0e32\u0e21\u0e2b\u0e32, \u0e02\u0e32\u0e22",2016-01-27 06:40:51
2,1,"  Check out my blog alagray.com for some wardrobe inspiration #beauty #beautiful #beautyblog #beautyblogger #fashion #fashionblog #fashionblogger #fashionable #fashionista #fashionstyle #style #stylish #styleblog #styleblogger #streetstyle #streetfashion #zara #stevemadden #michaelkors #marcjacobs #melrose #la  beautiful, fashion, beauty, fashionista, streetstyle, styleblog, beautyblogger, style, fashionblog, fashionable, la, styleblogger, marcjacobs, melrose, stevemadden, fashionstyle, zara, stylish, michaelkors, fashionblogger, streetfashion, beautyblog",2016-01-26 21:21:29
2,2,"  MAKES A GREAT PRESENT OR BIRTHDAY GIFT!!! * * *LARGER SIZE FASHIONABLE SHOES  AND BOOTS AVAILABLE * * * \nPlease DM for Prices and Purchase Invoice.\n\nSPECIAL \u25c7\u25c7 WE OFFER FREE US DOMESTIC SHIPMENT ON WEDNESDAYS. \nCHECK OUT OUR 2 ON LINE STORES AND PASS ALONG THESE GREAT BUYS TO FAMILY AND FRIENDS. Visit www.bonanza.com/booths/FURBUYSPLUS and furbuysplus2.storenvy.com for Designer items At Discount prices, (#COACH, #WOMEN #CLOTHES, #MK, #JUICY COUTURE, #VINCE CAMUTO  #ACESSORIES,  #VINTAGE,  #SHOES, #BAGS, #NY #GIANTS #FANS, #APPAREL, #REBORN,  #DOLLS, #DOLLS)\n\nNEW ITEMS LIST DAILY, SO PLEASE INQUIRE IF ITEM NOT SEEN IN OUR STORES.  CAN ALSO MAKE  INSTANT PURCHASE HERE ON INSTAGRAM TOO. PLEASE DM US!!.  giants, coach, shoes, vince, juicy, reborn, women, bags, vintage, mk, acessories, ny, fans, apparel, dolls, clothes",2016-01-26 04:33:20
2,3,"  #fashion #style #hot #pretty #beauty #girl #rich #lifestyle #fitness #makeup #foodporn #summer #me #michaelkors #sexy #love #hair #healthy #workout #like #beach #chanel #selfie #pink #black #jetsetlife #me #sun #butt #funny  summer, fashion, love, rich, beauty, foodporn, selfie, makeup, hair, me, butt, sexy, girl, chanel, pink, funny, style, lifestyle, like, healthy, sun, jetsetlife, hot, black, pretty, fitness, michaelkors, beach, workout",2016-01-27 04:30:19
2,4,"  #fashion #style #hot #pretty #beauty #girl #rich #lifestyle #fitness #makeup #foodporn #summer #me #michaelkors #sexy #love #hair #healthy #workout #like #beach #chanel #selfie #pink #black #jetsetlife #me #sun #butt #funny  summer, fashion, love, rich, beauty, foodporn, selfie, makeup, hair, me, butt, sexy, girl, chanel, pink, funny, style, lifestyle, like, healthy, sun, jetsetlife, hot, black, pretty, fitness, michaelkors, beach, workout",2016-01-27 03:53:05
2,5,"  #fashion #style #hot #pretty #beauty #girl #rich #lifestyle #fitness #makeup #foodporn #summer #me #michaelkors #sexy #love #hair #healthy #workout #like #beach #chanel #selfie #pink #black #jetsetlife #me #sun #butt #funny  summer, fashion, love, rich, beauty, foodporn, selfie, makeup, hair, me, butt, sexy, girl, chanel, pink, funny, style, lifestyle, like, healthy, sun, jetsetlife, hot, black, pretty, fitness, michaelkors, beach, workout",2016-01-27 04:11:52
3,1,"  Details \u270c\n#me #girl #style #mystyle #stylish #outfit #ootd #look #tenuedujour #outfitoftheday #outfitinspiration #outfitstyle #outfitselfie #fashion #fashionista #fashioninspo #streetfashion  #streetstyle #polishgirl #blogger #instablog #fashionblogger #dailyoutfit #clothes #lookbook #photooftheday #potd #urbanoutfitters #fromwhereistand \U0001f400  fashion, ootd, look, blogger, fashionista, streetstyle, lookbook, tenuedujour, fashioninspo, urbanoutfitters, girl, outfit, outfitstyle, me, fromwhereistand, style, dailyoutfit, outfitinspiration, clothes, outfitselfie, outfitoftheday, mystyle, polishgirl, instablog, stylish, potd, fashionblogger, streetfashion, photooftheday",2016-01-26 17:51:30
3,2,"  #fashion #gasbijoux #style #fashiondiaries #instadaily #fashionstyle #fashionphotography #picoftheday #fashionistas #lookbook #follow4follow #d\xfcsseldorf #instacool #zadigetvoltaire #20k #marcbymarcjacobs #celine #streetfashion #streetshot #instafashion #gucci #celineaddict #highfashion #fashiondiary #love #fashionaddict #blogger #fashionblogger  fashion, love, blogger, streetfashion, gasbijoux, fashionaddict, fashionphotography, zadigetvoltaire, marcbymarcjacobs, celine, follow4follow, 20k, instadaily, streetshot, style, fashiondiaries, fashionblogger, lookbook, celineaddict, d\xfcsseldorf, highfashion, gucci, instacool, fashionstyle, fashiondiary, fashionistas, picoftheday, instafashion",2016-01-26 11:59:01
3,3,"  @00000  #zara #louboutinworld #manoloblahnik #manoloblahnikshoes #dvf #jimmychoo #shoes #fashionworld #fashionblogger #fashionworldwide #styleblogger #styleblog #style  style, styleblogger, manoloblahnikshoes, fashionblogger, dvf, manoloblahnik, styleblog, louboutinworld, fashionworld, zara, jimmychoo, fashionworldwide, shoes",2016-01-21 07:24:47
3,4,"  Ootd! One of my favourites \U0001f33a  #fashion #fashionblogger #fashionistas #fashionkilla #fashionista #fashionshow #fashionable #fashionaddict #fashionlove #style #stylist #streetstyle #styleblogger #styled #styleblogger #stylish #ootd #ootn #outfit #outfitoftheday #outfitinspiration #f4f #l4l #love #cute #styleinspiration #americanstyle #aritzia #americanapparel #mystyle #converse  cute, fashion, love, fashionista, streetstyle, fashionshow, fashionaddict, americanapparel, outfit, americanstyle, ootd, converse, aritzia, ootn, styleinspiration, fashionkilla, style, stylist, fashionable, fashionblogger, outfitinspiration, styleblogger, outfitoftheday, mystyle, styled, f4f, stylish, fashionlove, fashionistas, l4l",2016-01-27 02:12:36
3,5,"  #fwis #fashion #fashionblog #fashionblogger #blog #blogger #ootd #outfit #outfitoftheday #potd #picoftheday #personalshopper #mainstyleshopping #metoday #w\xfcrzburg #w\xfcrzburg #streetstyle #style #leatherjacket #fendi #knitwear #knit #acne #acnestudios #paige #leaherpants #like4like #likeforlike  knitwear, fashion, fwis, blogger, acnestudios, streetstyle, outfit, fendi, ootd, w\xfcrzburg, knit, like4like, style, paige, acne, leatherjacket, personalshopper, mainstyleshopping, blog, outfitoftheday, likeforlike, fashionblog, leaherpants, metoday, potd, fashionblogger, picoftheday",2016-01-27 07:32:57
4,1,"  \u2708\ufe0f @zhanna_bianca #fashion#dubai#vip#sweet#love#candy#luxe#hermes#bag#chanel#pink#dream#oae#italy#fashionweek#lovefashion#tiffany#bluebox#wedding#cartier#louisvuitton#lv#croco#dior#leila#fashionblogger  pink, fashion, love, sweet, tiffany, dubai, lovefashion, vip, dior, wedding, hermes, chanel, luxe, croco, oae, italy, louisvuitton, fashionblogger, fashionweek, candy, lv, bluebox, leila, bag, dream, cartier",2016-01-27 04:22:54
4,2,"  \u2708\ufe0f @zhanna_bianca #fashion#dubai#vip#sweet#love#candy#luxe#hermes#bag#chanel#pink#dream#oae#italy#fashionweek#lovefashion#tiffany#bluebox#wedding#cartier#louisvuitton#lv#croco#dior#leila#fashionblogger  pink, fashion, love, sweet, tiffany, dubai, lovefashion, vip, dior, wedding, hermes, chanel, luxe, croco, oae, italy, louisvuitton, fashionblogger, fashionweek, candy, lv, bluebox, leila, bag, dream, cartier",2016-01-27 04:22:54
4,3,"  \u2708\ufe0f @zhanna_bianca #fashion#dubai#vip#sweet#love#candy#luxe#hermes#bag#chanel#pink#dream#oae#italy#fashionweek#lovefashion#tiffany#bluebox#wedding#cartier#louisvuitton#lv#croco#dior#leila#fashionblogger  pink, fashion, love, sweet, tiffany, dubai, lovefashion, vip, dior, wedding, hermes, chanel, luxe, croco, oae, italy, louisvuitton, fashionblogger, fashionweek, candy, lv, bluebox, leila, bag, dream, cartier",2016-01-27 04:22:54
4,4,"  \u2708\ufe0f @zhanna_bianca #fashion#dubai#vip#sweet#love#candy#luxe#hermes#bag#chanel#pink#dream#oae#italy#fashionweek#lovefashion#tiffany#bluebox#wedding#cartier#louisvuitton#lv#croco#dior#leila#fashionblogger  pink, fashion, love, sweet, tiffany, dubai, lovefashion, vip, dior, wedding, hermes, chanel, luxe, croco, oae, italy, louisvuitton, fashionblogger, fashionweek, candy, lv, bluebox, leila, bag, dream, cartier",2016-01-27 04:22:54
4,5,"  goodnight babes\n-\n-\n-\n-\n-\n-\n-\n-\n-\n-\n-\n-\n#followshoutout#followmeplease#f4f#sfs#openrp#makeup#beauty#pretty#food#models#model#prettypeople#rp#mac#sephora#tumblr#rpmodels#gainpost#girlstuff#girly#nails#michaelkors#ft#followmeback #followforlike#tumblr#tumblrfeed#goals#letsallgaintrain  followmeback, beauty, food, nails, makeup, sfs, tumblr, mac, followforlike, followmeplease, sephora, openrp, ft, gainpost, followshoutout, rp, girlstuff, girly, letsallgaintrain, models, pretty, rpmodels, f4f, tumblrfeed, model, michaelkors, prettypeople, goals",2016-01-27 03:29:13
5,1,"  \U0001f1ee\U0001f1f9MFW #milanofashionweek #fw1617 @00000 @00000 #victorndigwe #sergerigvava  @zegnaofficial #ermenegildozegna #fashionshow #elitemodelmanagement #models #eliteboysdoitbetter #milano #luomoelitemilano  sergerigvava, ermenegildozegna, models, milano, luomoelitemilano, fashionshow, eliteboysdoitbetter, fw1617, milanofashionweek, elitemodelmanagement, victorndigwe",2016-01-16 12:47:37
5,2,"  \U0001f1ee\U0001f1f9MFW #milanofashionweek #fw1617 @zegnaofficial #ermenegildozegna #fashionshow #elitemodelmanagement #models #eliteboysdoitbetter #milano #luomoelitemilano  ermenegildozegna, models, milano, fashionshow, eliteboysdoitbetter, fw1617, milanofashionweek, elitemodelmanagement, luomoelitemilano",2016-01-16 12:20:36
5,3,"  #ermenegildozegna #aw1617 #milanfashionweek #couture #fashion  couture, fashion, ermenegildozegna, milanfashionweek, aw1617",2016-01-16 17:38:54
5,4,"  \U0001f1ee\U0001f1f9MFW #milanofashionweek #fw16 @james_parker_95 #jamesparker @benjaminbenedek #benjaminbenedek @pozzialessio #alessiopozzi @brioni_official #brioni  #fashionshow #elitemodelmanagement #models #eliteboysdoitbetter #milano #luomoelitemilano  jamesparker, fw16, fashionshow, luomoelitemilano, milano, eliteboysdoitbetter, milanofashionweek, models, alessiopozzi, brioni, benjaminbenedek, elitemodelmanagement",2016-01-19 09:47:18
5,5,"  Milano Fashion Week\nErmenegildo Zegna FW 16/17\n\n#ermenegildozegna #milanofashionweek #modauomo #autunnoinverno20162017 #fallwinter20162017#menswear #love #TagsForLikes.com #TagsForLikesApp #instagood #me #smile #follow #cute #photooftheday #followme #TagsForLikes.com #beautiful #happy #picoftheday #instadaily #swag #amazing #TFLers #fashion #igers #fun #summer #instalike #bestoftheday#instamood  beautiful, cute, fashion, love, summer, instalike, milanofashionweek, tagsforlikesapp, modauomo, igers, fallwinter20162017, tflers, follow, instadaily, instagood, instamood, me, swag, ermenegildozegna, menswear, followme, tagsforlikes, amazing, bestoftheday, fun, smile, photooftheday, autunnoinverno20162017, picoftheday, happy",2016-01-17 21:20:36
6,1,"  #boutiqueingenito #boutique #ermenegildozegna #caruso #kiton #brioni #suit #abitouomo #bespoke #bestshop #beautiful #bestphoto #follow #followme #fotografia #fashion #fashionblog #lifestyle #like4like #luxury #luxurylife #italiansdoitbetter #instagood #instamillion #menslook #newyork #milan #mexicocity #singapore  beautiful, fashion, singapore, abitouomo, kiton, bespoke, italiansdoitbetter, lifestyle, milan, luxurylife, fotografia, follow, bestphoto, like4like, caruso, boutiqueingenito, ermenegildozegna, menslook, boutique, fashionblog, bestshop, instagood, newyork, luxury, suit, instamillion, followme, mexicocity, brioni",2016-01-12 20:07:14
6,2,"  #mensfashion #mensstyle #style #fashion #fashionblogger #london #menswear #sprezza #sprezzatura #dapper #fbloggers #wiwt #ootd #suitandtie #menwithclass #menwithstyle #canali #kiton #angelogalasso #newandlingwood  canali, fashion, sprezza, wiwt, kiton, menwithstyle, london, ootd, dapper, style, newandlingwood, menswear, sprezzatura, suitandtie, mensfashion, menwithclass, angelogalasso, fashionblogger, fbloggers, mensstyle",2016-01-16 16:06:13
6,3,"  #isaia #isaianapoli #stefanoricci #brioni #kiton #charvet #tomford #borrelli #cesareattolini #attolini #sprezzatura #style #fashion #accessories #details #cucinelli #brunellocucinelli #berluti #cucitaamano #handmade #zegna #ermengildozegna #johnlobb #bontoni #summer  summer, charvet, fashion, stefanoricci, attolini, johnlobb, kiton, accessories, zegna, cucinelli, brunellocucinelli, style, bontoni, berluti, cucitaamano, isaianapoli, isaia, cesareattolini, ermengildozegna, borrelli, handmade, tomford, sprezzatura, details, brioni",2015-09-25 02:42:46
6,4,"  #isaia #isaianapoli #stefanoricci #brioni #kiton #charvet #tomford #borrelli #cesareattolini #attolini #sprezzatura #style #fashion #accessories #details #cucinelli #brunellocucinelli #berluti #cucitaamano #handmade #zegna #ermengildozegna #johnlobb #bontoni #fall #50shadesofgrey  charvet, fashion, stefanoricci, attolini, johnlobb, kiton, accessories, zegna, cucinelli, brunellocucinelli, style, bontoni, fall, berluti, cucitaamano, isaianapoli, isaia, cesareattolini, ermengildozegna, borrelli, handmade, tomford, sprezzatura, 50shadesofgrey, brioni, details",2015-12-20 14:33:29
6,5,"  #isaia #isaianapoli #stefanoricci #brioni #kiton #charvet #tomford #borrelli #cesareattolini #attolini #sprezzatura #style #fashion #accessories #details #cucinelli #brunellocucinelli #berluti #cucitaamano #handmade #zegna #ermengildozegna #johnlobb #bontoni #summer  summer, charvet, fashion, stefanoricci, attolini, johnlobb, kiton, accessories, zegna, cucinelli, brunellocucinelli, style, bontoni, berluti, cucitaamano, isaianapoli, isaia, cesareattolini, ermengildozegna, borrelli, handmade, tomford, sprezzatura, details, brioni",2015-08-10 01:45:45
7,1,"  \u041d\u0430 %%%%%%%%%  scervino, \u043a\u0430\u0437\u0430\u043d\u044c, \u0443\u043a\u0440\u0430\u0438\u043d\u0430, \u0431\u0435\u043b\u0430\u0440\u0443\u0441\u044c, \u043c\u0438\u043d\u0441\u043a, fashionista, \u043c\u0430\u0445\u0430\u0447\u043a\u0430\u043b\u0430, mahachkala, \u043a\u0438\u0435\u0432, kashemir, \u043b\u043e\u0440\u043e\u043f\u044c\u044f\u043d\u0430, shoppingonline, ermannoscervino, kazakistan, grozniy, kazahstan, loropiana, ermanoscervino, kazakhstan, makhachkala, \u0441\u043e\u0447\u0438, \u043a\u0430\u0448\u0435\u043c\u0438\u0440, \u0433\u0440\u043e\u0437\u043d\u044b\u0439, cashmere, fashionblog, \u0430\u0441\u0442\u0430\u043d\u0430",2016-01-24 08:42:39
